{
  "count": 200,
  "generated_at": "2026-10-17T16:52:09Z",
  "items": [
    {
      "attempt": null,
      "destination": "chmoses98/soccer-edge-finder",
      "error_message": null,
      "error_type": null,
      "first_failed_at": null,
      "last_attempt_at": "2026-10-17T16:14:58Z",
      "retry_status": "RESOLVED",
      "rows": 9,
      "run_id": "39048574052",
      "run_url": "https://github.com/chmoses98/kalshi-bet-router/actions/runs/39048574052",
      "sport": "SOCCER",
      "started_at": "2026-10-17T16:14:58Z",
      "status": "DELIVERED",
      "wager_ids": []
    },
    {
      "attempt": null,
      "destination": "chmoses98/NHL-edge-finder",
      "error_message": null,
      "error_type": null,
      "first_failed_at": null,
      "last_attempt_at": "2026-10-17T16:14:58Z",
      "retry_status": "RESOLVED",
      "rows": 30,
      "run_id": "39048574052",
      "run_url": "https://github.com/chmoses98/kalshi-bet-router/actions/runs/39048574052",
      "sport": "NHL",
      "started_at": "2026-10-17T16:14:58Z",
      "status": "DELIVERED",
      "wager_ids": []
    },
    {
      "attempt": null,
      "destination": "chmoses98/nfl-edge-finder",
      "error_message": null,
      "error_type": null,
      "first_failed_at": null,
      "last_attempt_at": "2026-10-17T16:14:58Z",
      "retry_status": "RESOLVED",
      "rows": 148,
      "run_id": "39048574052",
      "run_url": "https://github.com/chmoses98/kalshi-bet-router/actions/runs/39048574052",
      "sport": "NFL",
      "started_at": "2026-10-17T16:14:58Z",
      "status": "DELIVERED",
      "wager_ids": []
    },
    {
      "attempt": null,
      "destination": "chmoses98/edge-finder-api",
      "error_message": "the auto-merge gate REFUSED this batch. The rows are delivered and remain on kalshi-router/MLB; they are NOT on main. See the named condition above.",
      "error_type": "the",
      "first_failed_at": "2026-10-17T16:14:58Z",
      "last_attempt_at": "2026-10-17T16:14:58Z",
      "retry_status": "WILL_RETRY",
      "rows": 119,
      "run_id": "39048574052",
      "run_url": "https://github.com/chmoses98/kalshi-bet-router/actions/runs/39048574052",
      "sport": "MLB",
      "started_at": "2026-10-17T16:14:58Z",
      "status": "FAILED",
      "wager_ids": []
    },
    {
      "attempt": null,
      "destination": "chmoses98/cfb-edge-finder",
      "error_message": null,
      "error_type": null,
      "first_failed_at": null,
      "last_attempt_at": "2026-10-17T16:14:58Z",
      "retry_status": "RESOLVED",
      "rows": 168,
      "run_id": "39048574052",
      "run_url": "https://github.com/chmoses98/kalshi-bet-router/actions/runs/39048574052",
      "sport": "CFB",
      "started_at": "2026-10-17T16:14:58Z",
      "status": "DELIVERED",
      "wager_ids": []
    },
    {
      "attempt": null,
      "destination": "chmoses98/soccer-edge-finder",
      "error_message": null,
      "error_type": null,
      "first_failed_at": null,
      "last_attempt_at": "2026-10-17T15:56:01Z",
      "retry_status": "RESOLVED",
      "rows": 9,
      "run_id": "39047208778",
      "run_url": "https://github.com/chmoses98/kalshi-bet-router/actions/runs/39047208778",
      "sport": "SOCCER",
      "started_at": "2026-10-17T15:56:01Z",
      "status": "SETTLED",
      "wager_ids": []
    },
    {
      "attempt": null,
      "destination": "chmoses98/NHL-edge-finder",
      "error_message": null,
      "error_type": null,
      "first_failed_at": null,
      "last_attempt_at": "2026-10-17T15:56:01Z",
      "retry_status": "RESOLVED",
      "rows": 30,
      "run_id": "39047208778",
      "run_url": "https://github.com/chmoses98/kalshi-bet-router/actions/runs/39047208778",
      "sport": "NHL",
      "started_at": "2026-10-17T15:56:01Z",
      "status": "SETTLED",
      "wager_ids": []
    },
    {
      "attempt": null,
      "destination": "chmoses98/nfl-edge-finder",
      "error_message": null,
      "error_type": null,
      "first_failed_at": null,
      "last_attempt_at": "2026-10-17T15:56:01Z",
      "retry_status": "RESOLVED",
      "rows": 148,
      "run_id": "39047208778",
      "run_url": "https://github.com/chmoses98/kalshi-bet-router/actions/runs/39047208778",
      "sport": "NFL",
      "started_at": "2026-10-17T15:56:01Z",
      "status": "SETTLED",
      "wager_ids": []
    },
    {
      "attempt": null,
      "destination": "chmoses98/cfb-edge-finder",
      "error_message": null,
      "error_type": null,
      "first_failed_at": null,
      "last_attempt_at": "2026-10-17T15:56:01Z",
      "retry_status": "RESOLVED",
      "rows": 159,
      "run_id": "39047208778",
      "run_url": "https://github.com/chmoses98/kalshi-bet-router/actions/runs/39047208778",
      "sport": "CFB",
      "started_at": "2026-10-17T15:56:01Z",
      "status": "SETTLED",
      "wager_ids": []
    },
    {
      "attempt": null,
      "destination": "chmoses98/soccer-edge-finder",
      "error_message": null,
      "error_type": null,
      "first_failed_at": null,
      "last_attempt_at": "2026-10-17T13:34:50Z",
      "retry_status": "RESOLVED",
      "rows": 9,
      "run_id": "39037144948",
      "run_url": "https://github.com/chmoses98/kalshi-bet-router/actions/runs/39037144948",
      "sport": "SOCCER",
      "started_at": "2026-10-17T13:34:50Z",
      "status": "DELIVERED",
      "wager_ids": []
    },
    {
      "attempt": null,
      "destination": "chmoses98/NHL-edge-finder",
      "error_message": null,
      "error_type": null,
      "first_failed_at": null,
      "last_attempt_at": "2026-10-17T13:34:50Z",
      "retry_status": "RESOLVED",
      "rows": 30,
      "run_id": "39037144948",
      "run_url": "https://github.com/chmoses98/kalshi-bet-router/actions/runs/39037144948",
      "sport": "NHL",
      "started_at": "2026-10-17T13:34:50Z",
      "status": "DELIVERED",
      "wager_ids": []
    },
    {
      "attempt": null,
      "destination": "chmoses98/nfl-edge-finder",
      "error_message": null,
      "error_type": null,
      "first_failed_at": null,
      "last_attempt_at": "2026-10-17T13:34:50Z",
      "retry_status": "RESOLVED",
      "rows": 148,
      "run_id": "39037144948",
      "run_url": "https://github.com/chmoses98/kalshi-bet-router/actions/runs/39037144948",
      "sport": "NFL",
      "started_at": "2026-10-17T13:34:50Z",
      "status": "DELIVERED",
      "wager_ids": []
    },
    {
      "attempt": null,
      "destination": "chmoses98/edge-finder-api",
      "error_message": "the auto-merge gate REFUSED this batch. The rows are delivered and remain on kalshi-router/MLB; they are NOT on main. See the named condition above.",
      "error_type": "the",
      "first_failed_at": "2026-10-17T13:34:50Z",
      "last_attempt_at": "2026-10-17T13:34:50Z",
      "retry_status": "WILL_RETRY",
      "rows": 119,
      "run_id": "39037144948",
      "run_url": "https://github.com/chmoses98/kalshi-bet-router/actions/runs/39037144948",
      "sport": "MLB",
      "started_at": "2026-10-17T13:34:50Z",
      "status": "FAILED",
      "wager_ids": []
    },
    {
      "attempt": null,
      "destination": "chmoses98/cfb-edge-finder",
      "error_message": null,
      "error_type": null,
      "first_failed_at": null,
      "last_attempt_at": "2026-10-17T13:34:50Z",
      "retry_status": "RESOLVED",
      "rows": 161,
      "run_id": "39037144948",
      "run_url": "https://github.com/chmoses98/kalshi-bet-router/actions/runs/39037144948",
      "sport": "CFB",
      "started_at": "2026-10-17T13:34:50Z",
      "status": "DELIVERED",
      "wager_ids": []
    },
    {
      "attempt": null,
      "destination": "chmoses98/soccer-edge-finder",
      "error_message": null,
      "error_type": null,
      "first_failed_at": null,
      "last_attempt_at": "2026-10-17T13:24:51Z",
      "retry_status": "RESOLVED",
      "rows": 9,
      "run_id": "39036450743",
      "run_url": "https://github.com/chmoses98/kalshi-bet-router/actions/runs/39036450743",
      "sport": "SOCCER",
      "started_at": "2026-10-17T13:24:51Z",
      "status": "SETTLED",
      "wager_ids": []
    },
    {
      "attempt": null,
      "destination": "chmoses98/NHL-edge-finder",
      "error_message": null,
      "error_type": null,
      "first_failed_at": null,
      "last_attempt_at": "2026-10-17T13:24:51Z",
      "retry_status": "RESOLVED",
      "rows": 30,
      "run_id": "39036450743",
      "run_url": "https://github.com/chmoses98/kalshi-bet-router/actions/runs/39036450743",
      "sport": "NHL",
      "started_at": "2026-10-17T13:24:51Z",
      "status": "SETTLED",
      "wager_ids": []
    },
    {
      "attempt": null,
      "destination": "chmoses98/nfl-edge-finder",
      "error_message": null,
      "error_type": null,
      "first_failed_at": null,
      "last_attempt_at": "2026-10-17T13:24:51Z",
      "retry_status": "RESOLVED",
      "rows": 148,
      "run_id": "39036450743",
      "run_url": "https://github.com/chmoses98/kalshi-bet-router/actions/runs/39036450743",
      "sport": "NFL",
      "started_at": "2026-10-17T13:24:51Z",
      "status": "SETTLED",
      "wager_ids": []
    },
    {
      "attempt": null,
      "destination": "chmoses98/cfb-edge-finder",
      "error_message": null,
      "error_type": null,
      "first_failed_at": null,
      "last_attempt_at": "2026-10-17T13:24:51Z",
      "retry_status": "RESOLVED",
      "rows": 159,
      "run_id": "39036450743",
      "run_url": "https://github.com/chmoses98/kalshi-bet-router/actions/runs/39036450743",
      "sport": "CFB",
      "started_at": "2026-10-17T13:24:51Z",
      "status": "SETTLED",
      "wager_ids": []
    },
    {
      "attempt": null,
      "destination": "chmoses98/soccer-edge-finder",
      "error_message": null,
      "error_type": null,
      "first_failed_at": null,
      "last_attempt_at": "2026-10-17T10:18:50Z",
      "retry_status": "RESOLVED",
      "rows": 9,
      "run_id": "39024419011",